{
  "$schema": "../../../schemas/v1/shard.schema.json",
  "schema_version": 1,
  "spatial_analyzer_target": "2026.1.0529.7",
  "category": "GDTOperations",
  "entries": [
    {
      "inventory_key": "sdk:GDTOperations_GDTAnalysis.txt#17",
      "mp_step": "Set Global Force Simultaneous Evaluation",
      "category_path": [
        "GDTOperations",
        "GDTAnalysis"
      ],
      "inventory_entry_sha256": "c4b3969103ec6c7987d41eb45754b1dd687089eab12e25200d8be1427f856e1d",
      "disposition": "blocked",
      "review_state": "reviewed",
      "rationale": "Exact-target documentation and SDK evidence leave one or more argument meanings, directions, or bindings unresolved; only this named command remains blocked pending focused reconciliation.",
      "reason_codes": [
        "argument_semantics_unresolved"
      ],
      "evidence_references": [
        "sdk:GDTOperations_GDTAnalysis.txt#17"
      ],
      "decision_references": [
        "https://github.com/spatialanalyzer/briosa/issues/49",
        "https://github.com/spatialanalyzer/briosa/issues/53"
      ],
      "blocker_references": [
        "https://github.com/spatialanalyzer/briosa/issues/79"
      ],
      "risk_effect": "mutating",
      "risk_flags": [],
      "data_classifications": [
        "non_sensitive"
      ],
      "value_families": [
        "logical"
      ],
      "delivery_wave": null,
      "command_shape": {
        "status": "blocked",
        "mp_step": null,
        "arguments": [],
        "discrepancies": [
          {
            "code": "documentation_command_missing",
            "argument_indexes": [],
            "owner": "hexagon",
            "blocker_reference": "https://github.com/spatialanalyzer/briosa/issues/79",
            "rationale": "Installed documentation and generated SDK evidence do not establish complete exact-target argument semantics for this command."
          },
          {
            "code": "sdk_argument_not_documented",
            "argument_indexes": [],
            "owner": "hexagon",
            "blocker_reference": "https://github.com/spatialanalyzer/briosa/issues/79",
            "rationale": "Installed documentation and generated SDK evidence do not establish complete exact-target argument semantics for this command."
          }
        ]
      }
    },
    {
      "inventory_key": "sdk:GDTOperations_GDTAnalysis.txt#20",
      "mp_step": "Generate Feature Check Summary",
      "category_path": [
        "GDTOperations",
        "GDTAnalysis"
      ],
      "inventory_entry_sha256": "ffecc8e92331ad29617adff2d502a5b890c413b777f5b94149896a6f322edab8",
      "disposition": "blocked",
      "review_state": "reviewed",
      "rationale": "Exact-target documentation and SDK evidence leave one or more argument meanings, directions, or bindings unresolved; only this named command remains blocked pending focused reconciliation.",
      "reason_codes": [
        "argument_semantics_unresolved"
      ],
      "evidence_references": [
        "sdk:GDTOperations_GDTAnalysis.txt#20"
      ],
      "decision_references": [
        "https://github.com/spatialanalyzer/briosa/issues/49",
        "https://github.com/spatialanalyzer/briosa/issues/53"
      ],
      "blocker_references": [
        "https://github.com/spatialanalyzer/briosa/issues/79"
      ],
      "risk_effect": "mutating",
      "risk_flags": [],
      "data_classifications": [
        "object_identifier"
      ],
      "value_families": [
        "collection_object_name_list",
        "string"
      ],
      "delivery_wave": null,
      "command_shape": {
        "status": "blocked",
        "mp_step": null,
        "arguments": [],
        "discrepancies": [
          {
            "code": "documentation_command_missing",
            "argument_indexes": [],
            "owner": "hexagon",
            "blocker_reference": "https://github.com/spatialanalyzer/briosa/issues/79",
            "rationale": "Installed documentation and generated SDK evidence do not establish complete exact-target argument semantics for this command."
          },
          {
            "code": "sdk_argument_not_documented",
            "argument_indexes": [
              1
            ],
            "owner": "hexagon",
            "blocker_reference": "https://github.com/spatialanalyzer/briosa/issues/79",
            "rationale": "Installed documentation and generated SDK evidence do not establish complete exact-target argument semantics for this command."
          }
        ]
      }
    },
    {
      "inventory_key": "sdk:GDTOperations_GDTConstruction.txt#2",
      "mp_step": "Make Surface Face List From Surface",
      "category_path": [
        "GDTOperations",
        "GDTConstruction"
      ],
      "inventory_entry_sha256": "ee17f962c9de3d6f50085db3b4cc06558558050673be4ade505b20a42cc75beb",
      "disposition": "blocked",
      "review_state": "reviewed",
      "rationale": "Exact-target documentation and SDK evidence leave one or more argument meanings, directions, or bindings unresolved; only this named command remains blocked pending focused reconciliation.",
      "reason_codes": [
        "argument_semantics_unresolved"
      ],
      "evidence_references": [
        "sdk:GDTOperations_GDTConstruction.txt#2"
      ],
      "decision_references": [
        "https://github.com/spatialanalyzer/briosa/issues/49",
        "https://github.com/spatialanalyzer/briosa/issues/53"
      ],
      "blocker_references": [
        "https://github.com/spatialanalyzer/briosa/issues/79"
      ],
      "risk_effect": "read_only",
      "risk_flags": [],
      "data_classifications": [
        "geometry",
        "object_identifier"
      ],
      "value_families": [
        "collection_object_name",
        "string"
      ],
      "delivery_wave": null,
      "command_shape": {
        "status": "blocked",
        "mp_step": null,
        "arguments": [],
        "discrepancies": [
          {
            "code": "documentation_command_missing",
            "argument_indexes": [],
            "owner": "hexagon",
            "blocker_reference": "https://github.com/spatialanalyzer/briosa/issues/79",
            "rationale": "Installed documentation and generated SDK evidence do not establish complete exact-target argument semantics for this command."
          },
          {
            "code": "sdk_argument_not_documented",
            "argument_indexes": [
              1
            ],
            "owner": "hexagon",
            "blocker_reference": "https://github.com/spatialanalyzer/briosa/issues/79",
            "rationale": "Installed documentation and generated SDK evidence do not establish complete exact-target argument semantics for this command."
          }
        ]
      }
    }
  ]
}
