{
  "$schema": "../../../schemas/v1/shard.schema.json",
  "schema_version": 1,
  "spatial_analyzer_target": "2026.1.0529.7",
  "category": "MPSubroutines",
  "entries": [
    {
      "inventory_key": "documentation:MPSubroutines/DefineSubroutineInputValues.htm",
      "mp_step": "Define Subroutine Input Values",
      "category_path": [
        "MPSubroutines"
      ],
      "inventory_entry_sha256": "d39d73a861b2b329a8b2044c39d758f3c86fa723c6faaec368880748c9412f85",
      "disposition": "intentional_exclusion",
      "review_state": "reviewed",
      "rationale": "Client-language state and control flow replace this measurement-plan programming helper.",
      "reason_codes": [
        "client_owned_state_and_control_flow"
      ],
      "evidence_references": [
        "documentation:MPSubroutines/DefineSubroutineInputValues.htm",
        "sdk:MPSubroutines.txt#2"
      ],
      "decision_references": [
        "https://github.com/spatialanalyzer/briosa/issues/52"
      ],
      "blocker_references": [],
      "risk_effect": "unknown",
      "risk_flags": [
        "unknown"
      ],
      "data_classifications": [
        "unknown"
      ],
      "value_families": [
        "unknown"
      ],
      "delivery_wave": null,
      "command_shape": {
        "status": "not_applicable",
        "mp_step": null,
        "arguments": [],
        "discrepancies": []
      }
    },
    {
      "inventory_key": "documentation:MPSubroutines/DefineSubroutineReturnValues.htm",
      "mp_step": "Define Subroutine Return Values",
      "category_path": [
        "MPSubroutines"
      ],
      "inventory_entry_sha256": "bd3f3c86c944888082855f2dbfb04bf8b089e4a3ba074d7512205eab62bbf969",
      "disposition": "intentional_exclusion",
      "review_state": "reviewed",
      "rationale": "Client-language state and control flow replace this measurement-plan programming helper.",
      "reason_codes": [
        "client_owned_state_and_control_flow"
      ],
      "evidence_references": [
        "documentation:MPSubroutines/DefineSubroutineReturnValues.htm",
        "sdk:MPSubroutines.txt#4"
      ],
      "decision_references": [
        "https://github.com/spatialanalyzer/briosa/issues/52"
      ],
      "blocker_references": [],
      "risk_effect": "unknown",
      "risk_flags": [
        "unknown"
      ],
      "data_classifications": [
        "unknown"
      ],
      "value_families": [
        "unknown"
      ],
      "delivery_wave": null,
      "command_shape": {
        "status": "not_applicable",
        "mp_step": null,
        "arguments": [],
        "discrepancies": []
      }
    },
    {
      "inventory_key": "documentation:MPSubroutines/ReturnFromSubroutineNow.htm",
      "mp_step": "Return from Subroutine Now",
      "category_path": [
        "MPSubroutines"
      ],
      "inventory_entry_sha256": "c483cf9e2c8e5b5fbb9b881c215510eaac5d4f5013a6c6aa06fd3c4fa5d39424",
      "disposition": "intentional_exclusion",
      "review_state": "reviewed",
      "rationale": "Client-language state and control flow replace this measurement-plan programming helper.",
      "reason_codes": [
        "client_owned_state_and_control_flow"
      ],
      "evidence_references": [
        "documentation:MPSubroutines/ReturnFromSubroutineNow.htm",
        "sdk:MPSubroutines.txt#3"
      ],
      "decision_references": [
        "https://github.com/spatialanalyzer/briosa/issues/52"
      ],
      "blocker_references": [],
      "risk_effect": "unknown",
      "risk_flags": [
        "unknown"
      ],
      "data_classifications": [
        "unknown"
      ],
      "value_families": [
        "unknown"
      ],
      "delivery_wave": null,
      "command_shape": {
        "status": "not_applicable",
        "mp_step": null,
        "arguments": [],
        "discrepancies": []
      }
    },
    {
      "inventory_key": "documentation:MPSubroutines/RunSubroutine.htm",
      "mp_step": "Run Subroutine",
      "category_path": [
        "MPSubroutines"
      ],
      "inventory_entry_sha256": "aa7e4303bdedad9b9471deb5ed9a41a8e79f06e9396c2a19cc6b4f0b38c036b1",
      "disposition": "intentional_exclusion",
      "review_state": "reviewed",
      "rationale": "Client-language state and control flow replace this measurement-plan programming helper.",
      "reason_codes": [
        "client_owned_state_and_control_flow"
      ],
      "evidence_references": [
        "documentation:MPSubroutines/RunSubroutine.htm",
        "sdk:MPSubroutines.txt#1"
      ],
      "decision_references": [
        "https://github.com/spatialanalyzer/briosa/issues/52"
      ],
      "blocker_references": [],
      "risk_effect": "unknown",
      "risk_flags": [
        "unknown"
      ],
      "data_classifications": [
        "unknown"
      ],
      "value_families": [
        "unknown"
      ],
      "delivery_wave": null,
      "command_shape": {
        "status": "not_applicable",
        "mp_step": null,
        "arguments": [],
        "discrepancies": []
      }
    }
  ]
}
