{
  "$schema": "../../../schemas/v1/shard.schema.json",
  "schema_version": 1,
  "spatial_analyzer_target": "2026.1.0529.7",
  "category": "CloudAndMeshOperations",
  "entries": [
    {
      "inventory_key": "sdk:CloudAndMeshOperations.txt#7",
      "mp_step": "Clear Cloud Point Deviations",
      "category_path": [
        "CloudAndMeshOperations"
      ],
      "inventory_entry_sha256": "55b044aabf254538bf5f52abdc7acbe93a87c716e6dc5e9b8001a43b77f820b6",
      "disposition": "blocked",
      "review_state": "reviewed",
      "rationale": "Exact-target documentation and SDK evidence leave one or more argument meanings, directions, or bindings unresolved; only this named command remains blocked pending focused reconciliation.",
      "reason_codes": [
        "argument_semantics_unresolved"
      ],
      "evidence_references": [
        "sdk:CloudAndMeshOperations.txt#7"
      ],
      "decision_references": [
        "https://github.com/spatialanalyzer/briosa/issues/49",
        "https://github.com/spatialanalyzer/briosa/issues/53"
      ],
      "blocker_references": [
        "https://github.com/spatialanalyzer/briosa/issues/79"
      ],
      "risk_effect": "mutating",
      "risk_flags": [],
      "data_classifications": [
        "geometry",
        "measurement",
        "object_identifier"
      ],
      "value_families": [
        "collection_object_name"
      ],
      "delivery_wave": null,
      "command_shape": {
        "status": "blocked",
        "mp_step": null,
        "arguments": [],
        "discrepancies": [
          {
            "code": "documentation_command_missing",
            "argument_indexes": [],
            "owner": "hexagon",
            "blocker_reference": "https://github.com/spatialanalyzer/briosa/issues/79",
            "rationale": "Installed documentation and generated SDK evidence do not establish complete exact-target argument semantics for this command."
          },
          {
            "code": "sdk_argument_not_documented",
            "argument_indexes": [],
            "owner": "hexagon",
            "blocker_reference": "https://github.com/spatialanalyzer/briosa/issues/79",
            "rationale": "Installed documentation and generated SDK evidence do not establish complete exact-target argument semantics for this command."
          }
        ]
      }
    }
  ]
}
