{
  "$schema": "../../../schemas/v1/shard.schema.json",
  "schema_version": 1,
  "spatial_analyzer_target": "2026.1.0529.7",
  "category": "GoogleSheetsOperations",
  "entries": [
    {
      "inventory_key": "sdk:GoogleSheetsOperations.txt#8",
      "mp_step": "Google Sheets Run Script",
      "category_path": [
        "GoogleSheetsOperations"
      ],
      "inventory_entry_sha256": "22225be7b90d6fb295368b500b5f190dbc85e7e5d3794d017c36b4ab7fa4e4cc",
      "disposition": "intentional_exclusion",
      "review_state": "reviewed",
      "rationale": "Spreadsheet integration belongs in the client application or a dedicated spreadsheet library.",
      "reason_codes": [
        "client_owned_spreadsheet_integration"
      ],
      "evidence_references": [
        "sdk:GoogleSheetsOperations.txt#8"
      ],
      "decision_references": [
        "https://github.com/spatialanalyzer/briosa/issues/52"
      ],
      "blocker_references": [],
      "risk_effect": "unknown",
      "risk_flags": [
        "unknown"
      ],
      "data_classifications": [
        "unknown"
      ],
      "value_families": [
        "unknown"
      ],
      "delivery_wave": null,
      "command_shape": {
        "status": "not_applicable",
        "mp_step": null,
        "arguments": [],
        "discrepancies": []
      }
    }
  ]
}
